{
  "$schema": "../schemas/tileset.schema.json",
  "version": 1,
  "id": "villagetileset",
  "name": "VillageTileset Test",
  "spriteSheet": "assets/VillageTileset.png",
  "columns": 32,
  "tileCount": 1024,
  "tiles": {
    "16": {
      "id": "tile_16_0",
      "terrainCorners": [
        "dirt",
        "dirt",
        "dirt",
        "dirt"
      ]
    },
    "17": {
      "id": "tile_17_0",
      "terrainCorners": [
        "dirt",
        "dirt",
        "dirt",
        "grass"
      ]
    },
    "18": {
      "id": "tile_18_0",
      "terrainCorners": [
        "dirt",
        "dirt",
        "grass",
        "grass"
      ]
    },
    "19": {
      "id": "tile_19_0",
      "terrainCorners": [
        "dirt",
        "dirt",
        "grass",
        "dirt"
      ]
    },
    "32": {
      "id": "tile_0_1"
    },
    "33": {
      "id": "tile_1_1"
    },
    "34": {
      "id": "tile_2_1"
    },
    "35": {
      "id": "tile_3_1"
    },
    "36": {
      "id": "tile_4_1"
    },
    "37": {
      "id": "tile_5_1"
    },
    "38": {
      "id": "tile_6_1"
    },
    "39": {
      "id": "tile_7_1"
    },
    "40": {
      "id": "tile_8_1"
    },
    "41": {
      "id": "tile_9_1"
    },
    "42": {
      "id": "tile_10_1"
    },
    "43": {
      "id": "tile_11_1"
    },
    "44": {
      "id": "tile_12_1"
    },
    "45": {
      "id": "tile_13_1"
    },
    "46": {
      "id": "tile_14_1"
    },
    "47": {
      "id": "tile_15_1"
    },
    "48": {
      "id": "tile_16_1",
      "terrainCorners": [
        "dirt",
        "dirt",
        "dirt",
        "dirt"
      ]
    },
    "49": {
      "id": "tile_17_1",
      "terrainCorners": [
        "dirt",
        "grass",
        "dirt",
        "grass"
      ]
    },
    "50": {
      "id": "tile_18_1",
      "probability": 40,
      "terrainCorners": [
        "grass",
        "grass",
        "grass",
        "grass"
      ]
    },
    "51": {
      "id": "tile_19_1",
      "terrainCorners": [
        "grass",
        "dirt",
        "grass",
        "dirt"
      ]
    },
    "52": {
      "id": "tile_20_1"
    },
    "53": {
      "id": "tile_21_1"
    },
    "54": {
      "id": "tile_22_1"
    },
    "55": {
      "id": "tile_23_1",
      "collision": {
        "type": "complex",
        "shapes": [
          {
            "id": "poly-1",
            "type": "polygon",
            "points": [
              [
                0,
                0
              ],
              [
                1,
                0
              ],
              [
                1,
                1
              ],
              [
                0,
                1
              ]
            ]
          }
        ]
      }
    },
    "56": {
      "id": "tile_24_1"
    },
    "57": {
      "id": "tile_25_1"
    },
    "58": {
      "id": "tile_26_1"
    },
    "59": {
      "id": "tile_27_1"
    },
    "60": {
      "id": "tile_28_1"
    },
    "61": {
      "id": "tile_29_1"
    },
    "62": {
      "id": "tile_30_1"
    },
    "63": {
      "id": "tile_31_1"
    },
    "64": {
      "id": "tile_0_2"
    },
    "65": {
      "id": "tile_1_2"
    },
    "66": {
      "id": "tile_2_2"
    },
    "67": {
      "id": "tile_3_2"
    },
    "68": {
      "id": "tile_4_2"
    },
    "69": {
      "id": "tile_5_2"
    },
    "70": {
      "id": "tile_6_2"
    },
    "71": {
      "id": "tile_7_2"
    },
    "72": {
      "id": "tile_8_2"
    },
    "73": {
      "id": "tile_9_2"
    },
    "74": {
      "id": "tile_10_2"
    },
    "75": {
      "id": "tile_11_2"
    },
    "76": {
      "id": "tile_12_2"
    },
    "77": {
      "id": "tile_13_2"
    },
    "78": {
      "id": "tile_14_2"
    },
    "79": {
      "id": "tile_15_2"
    },
    "80": {
      "id": "tile_16_2",
      "terrainCorners": [
        "dirt",
        "dirt",
        "dirt",
        "dirt"
      ]
    },
    "81": {
      "id": "tile_17_2",
      "terrainCorners": [
        "dirt",
        "grass",
        "dirt",
        "dirt"
      ]
    },
    "82": {
      "id": "tile_18_2",
      "terrainCorners": [
        "grass",
        "grass",
        "dirt",
        "dirt"
      ]
    },
    "83": {
      "id": "tile_19_2",
      "terrainCorners": [
        "grass",
        "dirt",
        "dirt",
        "dirt"
      ]
    },
    "84": {
      "id": "tile_20_2"
    },
    "85": {
      "id": "tile_21_2"
    },
    "86": {
      "id": "tile_22_2"
    },
    "87": {
      "id": "tile_23_2"
    },
    "88": {
      "id": "tile_24_2"
    },
    "89": {
      "id": "tile_25_2"
    },
    "90": {
      "id": "tile_26_2"
    },
    "91": {
      "id": "tile_27_2"
    },
    "92": {
      "id": "tile_28_2"
    },
    "93": {
      "id": "tile_29_2"
    },
    "94": {
      "id": "tile_30_2"
    },
    "95": {
      "id": "tile_31_2"
    },
    "96": {
      "id": "tile_0_3"
    },
    "97": {
      "id": "tile_1_3"
    },
    "98": {
      "id": "tile_2_3"
    },
    "99": {
      "id": "tile_3_3"
    },
    "100": {
      "id": "tile_4_3"
    },
    "101": {
      "id": "tile_5_3"
    },
    "102": {
      "id": "tile_6_3"
    },
    "103": {
      "id": "tile_7_3"
    },
    "104": {
      "id": "tile_8_3"
    },
    "105": {
      "id": "tile_9_3"
    },
    "106": {
      "id": "tile_10_3"
    },
    "107": {
      "id": "tile_11_3"
    },
    "108": {
      "id": "tile_12_3"
    },
    "109": {
      "id": "tile_13_3"
    },
    "110": {
      "id": "tile_14_3"
    },
    "111": {
      "id": "tile_15_3"
    },
    "112": {
      "id": "tile_16_3",
      "probability": 20,
      "terrainCorners": [
        "grass",
        "grass",
        "grass",
        "grass"
      ]
    },
    "113": {
      "id": "tile_17_3",
      "terrainCorners": [
        "grass",
        "grass",
        "grass",
        "dirt"
      ]
    },
    "114": {
      "id": "tile_18_3",
      "terrainCorners": [
        "grass",
        "grass",
        "dirt",
        "grass"
      ]
    },
    "115": {
      "id": "tile_19_3",
      "terrainCorners": [
        "dirt",
        "grass",
        "grass",
        "dirt"
      ]
    },
    "116": {
      "id": "tile_20_3"
    },
    "117": {
      "id": "tile_21_3"
    },
    "118": {
      "id": "tile_22_3"
    },
    "119": {
      "id": "tile_23_3"
    },
    "120": {
      "id": "tile_24_3"
    },
    "121": {
      "id": "tile_25_3"
    },
    "122": {
      "id": "tile_26_3",
      "collision": {
        "type": "complex",
        "shapes": [
          {
            "id": "poly-1",
            "type": "polygon",
            "points": [
              [
                0.375,
                0.5625
              ],
              [
                0.5625,
                0.5
              ],
              [
                0.75,
                0.4375
              ],
              [
                1,
                0.4375
              ],
              [
                1,
                1
              ],
              [
                0,
                1
              ],
              [
                0.1875,
                0.75
              ]
            ]
          }
        ]
      }
    },
    "123": {
      "id": "tile_27_3",
      "collision": {
        "type": "complex",
        "shapes": [
          {
            "id": "poly-1",
            "type": "polygon",
            "points": [
              [
                0,
                0.4375
              ],
              [
                0.4375,
                0.5625
              ],
              [
                1,
                1
              ],
              [
                0,
                1
              ]
            ]
          }
        ]
      }
    },
    "124": {
      "id": "tile_28_3",
      "collision": {
        "type": "full"
      }
    },
    "125": {
      "id": "tile_29_3",
      "collision": {
        "type": "full"
      }
    },
    "126": {
      "id": "tile_30_3"
    },
    "127": {
      "id": "tile_31_3"
    },
    "128": {
      "id": "tile_0_4"
    },
    "129": {
      "id": "tile_1_4",
      "properties": [
        {
          "key": "isFarmable",
          "value": true
        }
      ]
    },
    "130": {
      "id": "tile_2_4"
    },
    "131": {
      "id": "tile_3_4"
    },
    "132": {
      "id": "tile_4_4"
    },
    "133": {
      "id": "tile_5_4"
    },
    "134": {
      "id": "tile_6_4"
    },
    "135": {
      "id": "tile_7_4"
    },
    "136": {
      "id": "tile_8_4"
    },
    "137": {
      "id": "tile_9_4"
    },
    "138": {
      "id": "tile_10_4"
    },
    "139": {
      "id": "tile_11_4"
    },
    "140": {
      "id": "tile_12_4"
    },
    "141": {
      "id": "tile_13_4"
    },
    "142": {
      "id": "tile_14_4"
    },
    "143": {
      "id": "tile_15_4"
    },
    "144": {
      "id": "tile_16_4",
      "probability": 10,
      "terrainCorners": [
        "grass",
        "grass",
        "grass",
        "grass"
      ]
    },
    "145": {
      "id": "tile_17_4",
      "terrainCorners": [
        "grass",
        "dirt",
        "grass",
        "grass"
      ]
    },
    "146": {
      "id": "tile_18_4",
      "terrainCorners": [
        "dirt",
        "grass",
        "grass",
        "grass"
      ]
    },
    "147": {
      "id": "tile_19_4",
      "terrainCorners": [
        "grass",
        "dirt",
        "dirt",
        "grass"
      ]
    },
    "148": {
      "id": "tile_20_4"
    },
    "149": {
      "id": "tile_21_4"
    },
    "150": {
      "id": "tile_22_4"
    },
    "151": {
      "id": "tile_23_4"
    },
    "152": {
      "id": "tile_24_4"
    },
    "153": {
      "id": "tile_25_4"
    },
    "154": {
      "id": "tile_26_4",
      "collision": {
        "type": "full"
      }
    },
    "155": {
      "id": "tile_27_4",
      "collision": {
        "type": "full"
      }
    },
    "156": {
      "id": "tile_28_4",
      "collision": {
        "type": "complex",
        "shapes": [
          {